Author,Review URL,Description,Rating
Vikit Shetty,https://www.zoma.to/dZXaAdq,"Whenever someone new comes to bangalore,  I take them to this place and this place never disappoints. One of the best biryani place in Bangalore.",5.0
Prateek,https://www.zoma.to/zxKKgNn,"Very nice service, nice behaviour of staff . Good job- sharma ji & sameer",5.0
R.Gopi,https://www.zoma.to/YbkbvYg,no chance to make dine in book,1.0
Aravinda Mishra,https://www.zoma.to/LeKrprK,Nice food,5.0
Kunal,https://www.zoma.to/rDBMRkO,Meghana foods recently started serving bad food for takeaway and dining we had went for takeaway and when we got the biryani home and tasted it then the rice was not cooked properly and then we had panner and that was also a bit bad then surprisingly the extra panner that we took was tasting amazing but Meghana pls improve ur food….,2.0
Harsha K,https://www.zoma.to/voneLxN,The ambience here is too noisy. The workers here fight over small issues. We expected mango lassi to have mango pulp in it instead it had some ready made jelly pulp.,1.0
Kislay Kumar,https://www.zoma.to/OMPagRm,Good food and good service by Hemlal,5.0
Santosh,https://www.zoma.to/wgvOrEv,They servered neck peices in Biriyani,1.0
Baibhav Padhy,https://www.zoma.to/MNQoDgO,Kamdev served and treated us really well. Appreciate such service!,5.0
Sampriti Sahoo,https://www.zoma.to/nkbMZvQ,today dinner far meghna foods good food and gerate sarvice oder taker mr.kamdev good suggestion mr .ramjan good sarvice🥰🥰,5.0
Purnima,https://www.zoma.to/mbeMZyz,Mr .Arun was very helpfull,5.0
Anusha Kambala,https://www.zoma.to/EamxRzg,today dinner meghana foods good food grate sarvice mr ramjan mr kamdev 🥰🥰,5.0
Disha MJ,https://www.zoma.to/wbpyZMP,The veg biriyani was AMAZING,5.0
Mourya Sai,https://www.zoma.to/LPlZKbX,Very good food. The guy name Idris served very well.,5.0
Mrcomman Man,https://www.zoma.to/qnlwxaE,today diner megha foods diner biryani and stater good taste sarvice mr idresh odertaker mr kamdev good suggestion,5.0
Vishwanath Naik,https://www.zoma.to/zbnOAxl,im dinner far megha fod good food grate sarvice mr kamdev and mr hemlal,5.0
Bhanu Prakash,https://www.zoma.to/kDBaLBK,biriyani good taest ,5.0
Varun Karthik,https://www.zoma.to/PwPYmOl,Today lucnch far Meghana foods good food sarivice is good Mr idresh Oder taker Mr kamdev,5.0
Vijay Reddy,https://www.zoma.to/ybYpxPP,Spl fish fry boneless Biriyani good taste service is good Mr Suraj and Basheer,5.0
Sumanth,https://www.zoma.to/AAXqagp,I order nati biriani and chicken bonles biriyani good test good suggestion Mr Basheer service Mr deva <br/>staff is very friendly ,5.0
Gokul,https://www.zoma.to/NbGwQoP,good taste papper chicken and wonderful biryani ,5.0
Abhijit Agani,https://www.zoma.to/RKnmqRG,i wist at meghana foods inorder mt roast <br/>leg roast panner ghee roast taste is is very good suggestion Mr basheer and Suresh is good order taken <br/>sataf is very friendly good atmosphere ,5.0
DENNY GEORGE,https://www.zoma.to/gBROOGn,chicken leg roast is good test also boneless biriyani good suggestion mr suresh service suraj,5.0
Siva Ndvs,https://www.zoma.to/kDylaky,Service is too good Murtza and Basheer<br/><br/>fish and chicken items are good ,5.0
Nitheesh Repalle,https://www.zoma.to/Qqevglb,"service was too good,must try chicken leg roast ,panner ghee roast ",5.0
Omprakash Biswal,https://www.zoma.to/kDyropK,today diner Meghna foods I'm order for mutton fry and and Meghan biryani good tasty good suggestion Mr kamdev and sarvice Mr idrish ,5.0
Joyal Joseph,https://www.zoma.to/OxZnyLQ,@Suraj helped a me lot on serving the food.<br/>@Kamadev help3d on managing those. ,5.0
Mohd Kaifee,https://www.zoma.to/MNerdBY,"service was really good from Murtaza, basheer. appreciated",5.0
Keerthi Vardhanapu,https://www.zoma.to/PwaaMzd,today going meghana foods I'm order for leg roast and mutton fry good tasty good suggestion far mr kamdev sarivice me idresh good sarivice 🥰,4.0
Harika,https://www.zoma.to/ybzzwvY,today going to meghna food I'm oder for butter chicken curry and butter naan good tasty biryani also good Mr Suresh good suggestions sarvice me Manoj 🥰🥰,5.0
Rashmitha A R,https://www.zoma.to/aqrrRao,"Taste is very nice, Chicken kodi vepudu taste is good and biryani too<br/>captain raghavendra very humble service ",5.0
K Praveen Kumar,https://www.zoma.to/eAebydA,"best restaurants in Bangalore Marathahalli meghana foods and As soon as we went to Meghna Foods, Subbu received us, looked after us very well and became friendly with us We want Thane to receive it again subbu and Very well serviced",5.0
D.venkatareddy,https://www.zoma.to/rElndnQ,"best restaurant in Bangalore,staff(subramanyan) is very friendly especially,food is very tasty ",5.0
Nikhil Adarsh,https://www.zoma.to/zbQzKbn,Food was awesome with good quantity as well as good quality served specially by Bashir and Pradeep(Friendly Staff),5.0
Meghana,https://www.zoma.to/mbXlKqq,today going to meghana foods marthali dinner guntur chicken &boneless biriyani good tastey oder taker Mr. atanu maity &kamdev Srivice Mr. akbar good 🥰,5.0
Yashwanth,https://www.zoma.to/mbXlKMk,the food and service was good and very comfortable <br/><br/>ATANU MAITY IS VERY GOOD FOR SERVICE AND EASY TO COMMUNICATE ,5.0
MamathaVinod,https://www.zoma.to/nkPDXra,im going today lunch my frends and me meghana foods good tastey food sarivice mr ramjan oder taker kamdev good sugtion ,5.0
Gowda Nagesh,https://www.zoma.to/BZPNRde,I'm visited today Marathalli Meghana foods i eat mutton biriyani very nice.. ,5.0
PRAKASHREDDY,https://www.zoma.to/kDNgmAy,Today going Meghana foods dinner marthali my family I’m Oder far mutton fry and chicken lollipop good tastey Oder taker Mr kamdev good suggestion steward Mr  Saivice also good,5.0
Anil Kumar.D,https://www.zoma.to/XLLZYYO,Yesterday we visited Marathahalli Meghana foods with friends.Order taker Mr kamdev  suggested chicken leg roast taste is awesome and excellent service .we enjoyed a lot ,5.0
Bikash,https://www.zoma.to/MNNKkgr,we all' friends visited today meghana foods<br/>heavy rain is their but we want to eat meghana foods biriyani..<br/>nice food I love boneless chicken biriyanai with half egg yummy..fast service so super ,5.0
Suray,https://www.zoma.to/pRRXXBk,my name is Surya I'm coming from Hyderabad food was excellent but service is bad I'm order to fresh lime soda but given butter milk. order taker was talking very rudly I'm asking the name not responding.plz change the staffs service is very bad,5.0
Deepak Singh,https://www.zoma.to/NYxxZKa,food was good,4.0
Mayank Yadav,https://www.zoma.to/kOLQKOe,Tried the Meghana special. Really bad biryani. It was just chicken put on top of rice. The rice was hardly flavorful and even had parts where it was just plain white rice!<br/>Chicken was overcooked and had lost all texture. <br/><br/>Not going back ever again.,1.0
Sathish J,https://www.zoma.to/ZLwdDRP,good,5.0
Sravani,https://www.zoma.to/DPeBQQn,,5.0
Pratibha Nair,https://www.zoma.to/kOlDyYy,"We ordered the Meghana special chicken biryani. The rice and chicken are packed separately for delivery. Each grain of rice was perfectly cooked and infused with the rich flavor of the spices. The chicken pieces are small, juicy, tender of meat that added a unique flavor when combined with the rice. However, the raitha was not that great.<br/>Overall loved the flavor and definitely would recommend to everyone.<br/> <br/>",4.0
Santhosh,https://www.zoma.to/QkYPdob,If you used to order online meghana biriyani don’t get disappointed taste is same but u ill get low quantity!,5.0
Ananya Verma,https://www.zoma.to/pdYgvMN,great food and amazing service by Ganesh ☺️ <br/>,5.0
Augustin K R,https://www.zoma.to/AOKxKAv,Visited and had Meghana Special Briyani. So damn spicy. They charge so high but can’t give a proper Raitha. A normal buttermilk will be better than their raitha. It not even a good Briyani which is over hyped. So much noise from Kitchen and too many staff going around and walking shouting all the time,2.0
Subham,https://www.zoma.to/ZLMPBEv,The biryani is super delecious. The best you can find in bangalore. If you are craving for biryani without any doubts choose meghana’s. The staff is super nice and hospitable specially mr. shoven will definitely help you out in choosing the best biryani they had to offer.,5.0
Satya Raju,https://www.zoma.to/eKgNmBA,We have ordered Chicken fried rice .. It was worse sate .. it 90 min to deliver just for 5 km .. Taste is pathetic..,1.0
Yashas Gowda,https://www.zoma.to/wXZmyGa,Ganesh from meghana's food marathalli was very good service and the service management was very very good and i and my friends loved it thank you so much meghana's ❤️,5.0
Rahul Dora,https://www.zoma.to/MZgeazw,"I had ordered Mutton Biryani for which the waiter initially confirmed that the stock for the same is over. But later he asked for someone’s confirmation and took the order for the same along with other orders.<br/>Upon serving, the waiter informed that the mutton Biryani’s stock is over.<br/><br/>Funny thing, we received Mirch ka Salan along with raita which is served alongside Biryani , but biryani was not at all served.",1.0
Abhishek Singh,https://www.zoma.to/ERAoeGw,nice Indians very amazing food my experience excellent awesome service your food quality is a superb staff behaviour is good I am very happy thank you ,5.0
Chris Jo,https://www.zoma.to/nRMlmNv,Late night grab not that bad . Pretty good biryani nice and well seasoned aromatic. reasonable pricing. tandoori chicken was well cooked . overall not bad .Loved the lightings . definitely come again ☺️,4.0
Girish Balakrishnan,https://www.zoma.to/dBKakMP,order was around 1400. Ghobi Manchurian was staled. Food quality was really bad. it was on 30th Dec 23,2.0
Suchetha Karanth,https://www.zoma.to/LAlnQzv,"Meghana Foods is a go-to destination for biryani enthusiasts, offering an amazing array of this flavorful dish. What sets it apart is its commendable selection of biryani options for vegetarians, catering to a diverse range of preferences. The portions are substantial, with one order proving to be fulfilling, making it an ideal spot for families seeking a hearty meal. While the absence of soup options might be a drawback for some, the overall experience at Meghana Foods is a treat, especially for non-vegetarians who can relish the rich and diverse flavors of their biryani offerings.",5.0
Shreya Thakur,https://www.zoma.to/KBrGdGR,"The ambience, service and food is great! highly recommend.  Kamdev was are host and really took great care of us.",5.0
Ankit Kumar,https://www.zoma.to/pgnGLXA,Amazing service by Ganesh and really enjoyed thhe food and service,5.0
Harish Mattla,https://www.zoma.to/NAnPNEQ,"Nice service and Ganesh has good customer interaction,",5.0
Ranjitha S,https://www.zoma.to/aNrLrly,Ganesh was excellent with attitude and he is so passionate about the work that he does.<br/>he is smiling throughout the time we were in the Restaurant.,5.0
Singh Jii,https://www.zoma.to/ERQDMgB,It was my second visit and really enjoyed my dinning must visit the place and specially I'll thank to mr .ganesh nath for his pleasent and charming behaviour towards us . Thank you so much .,5.0
Munilokesh,https://www.zoma.to/GrQArRy,Food is Good and Tasty.. staff is also friendly... <br/>Ganesh has served me food and he is polite and always keeps smile...<br/><br/>thanks to Meghna Team..,5.0
Amita Chauhan,https://www.zoma.to/NARlBXa,"The service provided by Ganesh was very good, very welcoming and warm in gesture",5.0
Ashwini,https://www.zoma.to/eKqlBvG,nice foods decilious taste serve by coptan subbu whitar naveen ,5.0
Prithi,https://www.zoma.to/aNzrXye,"Good biriyani, good sides and good ambience. Everything is a bit too spicy- but biriyani needs to be spicy to taste good. It will hit you in the face while having it but after awhile you will end up craving the same. The restaurant is clean and waiters are very attentive, the drinks we had are lime soda and meghna spl sarbath which is nothing special, its just fine but you will need something sweet right after to balance out the spice. Overall this place is recommended for people who like spicy food and if your not good with spice also recommended - there is a cream stone down the block for dessert. I dont know if its just me or if there really is a difference between the meghna spl biriyani and the other normal biriyanis- all tasted the same. The starters also had a meghna spl 555 which tasted pretty similar to every other chicken starters we tried.",5.0
Maitri Mudumbi,https://www.zoma.to/ynOBzvD,Ganesh was our server today and the food was amazing and the staff was very hospitable ,5.0
Tauseef,https://www.zoma.to/wXRNZRl,Amazing food and good service! <br/>Especially by Ganesh!,5.0
Chaithanya Marasani,https://www.zoma.to/mPwnLkl,Raghavendra and Sumanth's service is very good. food was very tasty ,5.0
Sudheer,https://www.zoma.to/dBmMXlr,perfect taste,5.0
Ramya,https://www.zoma.to/wXkNPEd,service was awesome by Subbu @subramanyam ,5.0
Vinod Kumar,https://www.zoma.to/KBwqyOl,,5.0
Rajesh Chenuru,https://www.zoma.to/pgqkAAG,good sarvice and good food ,5.0
Eswar Chand,https://www.zoma.to/QPNqAlB,"Tasted like hyd biriyani<br/>Service is good- Prasanna Kumar, G Subbu👍👍👍",5.0
Leena Achari,https://www.zoma.to/vzmqYwk,,5.0
Vikram Chavan,https://www.zoma.to/bNemeno,Nice and quiet ambiance with good interiors and supportive staff/ team. I ordered their boneless biryani and pepper chicken. Must say they really use quality ingredients to prepare their food. The rice quality was great and it was perfectly cooked with the chicken masala they put on top of it. If you like spicy then you must try.,4.0
NIKITA MAHAPATRA,https://www.zoma.to/gLgyBLb,,4.0
Jigar,https://www.zoma.to/vzzrvwO,,5.0
Junny Walker,https://www.zoma.to/PXXbkgB,Guntur chicken is very tasty. Chicken Hyderabadi curry bone also very good. service also good <br/> Service ,5.0
Debadutta Rath,https://www.zoma.to/DLNkyZR,"The quality,taste and quality has been degraded drastically",1.0
Duruva Ganesan,https://www.zoma.to/dBNbEEO,,5.0
Tina,https://www.zoma.to/zRdbbvR,Absolutely delicious Hyderabadi style Biriyani. <br/>Good service (by Sai Kumar sir) and pleasant ambience. <br/><br/>,5.0
Ram,https://www.zoma.to/zRdZevz,nice food and staff. sai nice service,5.0
Mohan Krishna,https://www.zoma.to/AnNOXMR,"They are providing quality food, and k.sai Kumar's accommodation and service quite good.. appreciate his service.. loved the restaurant vibe ",5.0
Kumar SiddharTh,https://www.zoma.to/yaKmZrG,Very less quantity and very bad service they just want people come and go. Once you finish the plate they will forcefully remove from the seat. <br/><br/>Wrong billing caused us loss of Rs 350. <br/>Dony know why people like meghna biryani. Taste was also not worth it and as well as quantity.  They don’t have any offer throughout the year. <br/>I personally dont like meghna foods biryani at all.,1.0
Joe Jaswanth Raj L,https://www.zoma.to/QKymolQ,,5.0
500643,https://www.zoma.to/nvxNgqK,"Panner biriyani is good ,panner bater masala is nice food tq sarvice is very good ....mr hem lal very good sarvice tq <br/>",5.0
Jayashree G,https://www.zoma.to/ZMzLmzr,Best suggestion is Hyderabad chicken curry . Thanks to Mr. Liku kumar for good service!!,5.0
Lokesh Kandregula,https://www.zoma.to/DNgPQYL,Food taste is good and beverages also very nice<br/>Caption liku Kumar service is good<br/>Chicken boneless biryani taste is good<br/><br/>,5.0
Kalyan Kanumalla,https://www.zoma.to/NZEYvzd,Food was good<br/><br/>Ordered paneer biryani and gobi manchuria starter <br/>Quality was good and  service too . .,5.0
Shilpa,https://www.zoma.to/pewepQm,,5.0
Karunakar,https://www.zoma.to/nveMDvQ,Food is awesome as well as the staff especially K.Sai Kumar<br/>Tandoori is a must try and dum biryani with bone <br/>Recommended for all ,5.0
Manas Kumar,https://www.zoma.to/wvOdKqM,,1.0
R Subbu,https://www.zoma.to/yaoLbbg,Biryani is good but gravy quantity is very less and not at all sufficient for the biryani and due to this we need to buy extra gravy by paying more when we order from online.,2.0
Pratik Tarafdar,https://www.zoma.to/LndPvGk,INR 450 (excl. GST) for a small portion of mutton biryani is unreasonable. Too pricy. Not the place for a humble family of 4 to dine. But the taste was fantastic. ,4.0
Adrija Chatterjee,https://www.zoma.to/qvbADeZ,,4.0
Sourav Kumar Nanda,https://www.zoma.to/ZMwgpDo,,4.0
Hardik Sharma,https://www.zoma.to/yapqmgD,Co-operative staff and excellent service by malyala srikanth and nagraju captain . Food quality is worth spending and taste is awesome.,5.0
Shyam,https://www.zoma.to/kaqOkye,"Awsome taste,Suresh & sharma's service is really good.. we have ordered Biriyani really meghana deserves 5* rating...",5.0
Anand Kumar Ray,https://www.zoma.to/GnbEvvl,Hemlal was nice while delivering the service to the dining table and I would recommend anyone who loves biryani ,5.0
Srinidhi G,https://www.zoma.to/peGOXMG,,5.0
G Subramanyam,https://www.zoma.to/GnbLyOK,Prawns biryani so good chicken paper &thandhuri its amazing i really enjoyed good taste staf also frindly talking mr basheer good suggested order taker subbu good service & quick serve ,1.0
Nishant Singh,https://www.zoma.to/BkOLmDk,We liked the food and ambience.. food was served  timely and taste was very nice. Liked the starters as well... ,5.0
Bidhan Sarkar,https://www.zoma.to/ovrNbpe,Apollo fish also good <br/>Good suggestion Mr basheer capt service also good Mr Subbu good atmosphere in restaurant ,5.0
Voosa Manjula,https://www.zoma.to/eoLKeLr,I'm lunch for mrghena foods I'm oder mutton peper &chicken lolipap good tastey srivice good mr hemlal &good suggestion mr kandev good oder taker so lovely food,5.0
982699,https://www.zoma.to/ovrkkDx,Awesome customer service Sai Kumar and Bachan .. will definitely visit next time I'm here in Blore Thank you ,5.0
Suryateja Chunduru,https://www.zoma.to/wvYXXAG,,5.0
Varsha T S,https://www.zoma.to/peGewoO,,5.0
Riya Mondal,https://www.zoma.to/aAmAEeE,Test is too good as well service is too good <br/>Try once in meghana Sai kumar<br/>Chicken vepudu<br/>Matan biryani,5.0
Arjun Manoharan,https://www.zoma.to/qvovyEM,Food is good and the hospitality is nice. My favourite is Meghana special biriyani. Sai Kumar take of our table and helped us in choosing start dishes,5.0
Ravi,https://www.zoma.to/nvbXMXO, Today I have visited to meghana foods I had very tasty food which is suggested by mr. <br/>Sai Kumar . He is very polite and gentle ,5.0
Prem,https://www.zoma.to/nvbdpbr,Yesterday i visited in meghana food again with friends. I found better then before meghana. As food test and ambiance. Service is always good in meghana food Marathahalli. Same guy serve us yesterday also Mr.Bhavani he is nice guy there. good respect even too much crowd. There is good responsable staff and nice food that's why meghana is in best position in Marathahalli.... 5 stars always...,5.0
Ramanand,https://www.zoma.to/zMozPAL,today diner for meghana foods I’m Oder chilly chicken a/s & chicken fry Britain good taste &good sarivice mr Rakesh Oder taker mr kamdev good suggestions lovely food,5.0
Sunil M,https://www.zoma.to/dNYAKlP,Today lunch meghana foods I'm oder chicken lolipop &natichicken biriyani goods taste srivice Mr Usman good sarivice oder taker Mr kamdev good suggestion lovely food🥰🥰🥰,5.0
Ashish Anand,https://www.zoma.to/nvlXLrG,No complains on food but Dine in is not for everyone. Feels like people are walking over your head. There is always a wait time which you just to stand and form a crowd. <br/><br/>Everything is rushed. Items that will take time will be discouraged. Delivery experience is better. ,3.0
Nivetha,https://www.zoma.to/LnBlPka,Food was really tasty - mushroom Biryani and gobi and paneer starters were spicy and fresh - professional and Good service by Atanu,4.0
Chandrakanth,https://www.zoma.to/yaPBLbO,Bhavani  and Atanu has been very generous in serving the food on time and great service in Meghana foods,5.0
S I  Karimullah,https://www.zoma.to/LnBYlXa,Today I'm going for lunch Meghna foods I'm oder chicken lollipop & ¹Appolo fish good tasty &mutton biriyani good tasty oder taker kamdev good suggestion &Mr Sharma good srivice lovely food ,5.0
Vishali,https://www.zoma.to/yaPByDG,Food was great and the service was also good. Meghana SPL biriyani is a must try. Atanu who served us was also really pleasing. ,4.0
Madhusudhan,https://www.zoma.to/yaPBlPO,,5.0
Rishav,https://www.zoma.to/NZyKwvO,"Full 5 stars just for the fantastic mutton fry, period! Similar cuisine and preparation like Nagarjuna. Have always loved their veg and non veg special biryanis. The paneer tikka starter is also worth a try",5.0
Sai Bhargavi,https://www.zoma.to/eoMympr,,3.0
Biswajit Das,https://www.zoma.to/AKkNMXA,Went to dine in. Didn't book a table. Just walkin. But the way the service people behaved as if we were beggars. This kind of service should be thrashed.,1.0
Nagaraj,https://www.zoma.to/ObDMZgE,,1.0
Sudhish Kumar,https://www.zoma.to/rnoeybw,Ordered vegetarian food but received non vegetarian food.  This is completely unacceptable and irresponsible.,1.0
Rahul,https://www.zoma.to/pereRzk,It was a very experience here .. excellent food.... prompt service...very good ambiance...<br/>Very good place to spend time with family and friends..,4.0
Sandeep Reddy,https://www.zoma.to/ovOdmre,Not like before. Today I got very less Quantity. And even chicken pieces are very less. I bought a boneless Biriyani. So please ,1.0
CHIGICHERLA PRASHANTH,https://www.zoma.to/MAErnXO,,5.0
Swathi Prabha,https://www.zoma.to/rnAGrnw,,5.0
Rajib,https://www.zoma.to/peznPlw,Today i go to meghana food Marathahalli branch Mr. Rajib suggest for chiken rost really this one very good test and biryani also serve very fast and nice 🙂,5.0
Binod Bhandari,https://www.zoma.to/qvmZAYA,Good Tested every items very nice & very good service ..Meghana chicken 555 stater also very nice&Biriyani also superb ,5.0
Vani,https://www.zoma.to/zMBPGaG,,1.0
Rakesh Pudipeddi,https://www.zoma.to/mRobmOk,Good food. Non veg Biryani is the best. I'm oder for chicken rayala Seema good test good suggestion for mr kamdev so lovely 🥰🥰🥰,5.0
✨,https://www.zoma.to/eoeqKpD,"Amaaaaaaazingggggg taste, authentic Chicken Biriyani taste with yummilicious Chicken Lollipop,prawn biriyani,Salan,Raita.<br/><br/>Thnq 😍",5.0
Suraj S,https://www.zoma.to/DNQoAYA,"Had been to this Meghana Foods branch for the first time. Today we had so much cravings for having Biriyani and being Bengalurians we always trusted Meghana Foods for any Biryani, ultimately we had Paneer Biryani and it was best as expected. One biryani is good enough with respect to taste and quantity. It Satisfied the whole. After having such a good meal we went with a glass of Butter Milk, it was good, could've been best.<br/><br/>I request management to maintain the same hygiene and taste and keep serving Biryani at it's best 🤩👍.",4.0
Sheza Parveen,https://www.zoma.to/ldnPwxK,The food was little spicy but good. The portion was a little less for two people to eat.<br/>Overall experience was good. The service was very fast.<br/>The place was crowed and we had to wait for someone to finish so that we can sit. Too much rush.<br/>One can visit with family and friends.<br/>(Sorry couldn’t take much photos)<br/>,4.0
Saumye Srivastava,https://www.zoma.to/QKmEnXd,Terrible experience! Unhygienic.<br/>Bad food quality and took 1 hour to service food. Waiters were rude. The biryani was smelling.,1.0
Hi.vijesh,https://www.zoma.to/vYXrRlL,,1.0
Shashi Kumar,https://www.zoma.to/ldNLobm,"We visited Meghna foods for a late lunch on a Sunday. Despite menu was shared, we came to know that only boneless chicken briyani is available and under beverage only soft drinks were available. First of all I dont understand concept of boneless chicken briyani, as its chicked cooked with some gravy served on top of briyani rice ( read flavored rice). If chicken and rice are cooked separately how it is a chiken biryani? The taste was not what we expected. <br/><br/>Better inform at the entry itself that only 2 items are available rather giving menu to decide and then get disappointed as your desired item is not available.<br/><br/>Service was not upto the mark, we saw order was received to tables where people come after us. Even  salads were not served to us despite asking for it. We have to remind the service guy multiple times to give salad and tumblers.",1.0
Umesh C,https://www.zoma.to/EgwpNag,The boneless chicken biriyani was delicious and quantity is more than sufficient for one person and it was too heavy,5.0
Nandini M,https://www.zoma.to/ldzqwgo,,1.0
Rituraj Bisht,https://www.zoma.to/DNvvBMk,"Finally we got a chance to visit the legendary Meghna Biryani food outlet. As expected, it was crowded and wait time was around 15-20 min.<br/><br/>One of the manager helped in getting early seats and finally we got seats although not great but it was seat and we can start ordering.<br/><br/>We ordered prawns biryani, chicken boneless biryani and tandoori roti. Although food prep time was more but food taste was amazing. Overall a great experience in term of food taste",4.0
Sukanya RK,https://www.zoma.to/qvRaBBn,,5.0
Alcohol Lover Dev Apu,https://www.zoma.to/ObxZKAa,,5.0
Dhiraj Chandra,https://www.zoma.to/vYBLlOL,"Nowadays Meghna always supply bad quality in biryani rice,  sometimes stale sometimes partially cooked",1.0
Shashi Shekhar,https://www.zoma.to/xvvrkrA,Today I'm going diner for Meghan foods will be oder for chicken leg roast and lollypop and biriyani so good tasty so nice sarivice waitr Mr parkash &Mr srikant oder taker Mr kamdev good suggestion stater leg rosat chicken good tastey so lovely food ,5.0
