Author,Review URL,Description,Rating
Madhusmita Padhy,https://www.zoma.to/QYQpXy,Was longing to visit this place after knowing a bollywood movie was shot here and of course for their positive word of mouth about biryanis.<br/>And I had to try after they opened an outlet near my residence in marathahalli.<br/>So it wasn't a rumour after all..They do serve amazing biryani :)<br/>Other items we ordered also tasted just right.<br/>But somehow I found it lacking in their service.. Probably coz its overcrowded.<br/>One can definitely go back again n again for having their Biryanis.,3.5
Arun Prasad M,https://www.zoma.to/lGDqyA,"Ok, Hands down one the best biryani in Bangalore for me. Anytime you visit this place i get fresh and hot biryanis. Their starters are good, north indian dishes are good, meals is also fine. Consistency is what i like about them, they haven't changed the taste much for years i get the same old taste when they started in Koramangla. Good value for money and would keep visiting again & again.",3.5
Dipendra Rajpal,https://www.zoma.to/vkMbML,"Meghna foods.. popularly knows as Meghna Biryani :)  Awesome food, nice ambience, spicy biryani. They have varieties of biryani. I have tried chicken biryani, boneless biryani, fish biryani, paneer biryani and meghna special. liked it. The place is too much crowded and mostly on weekends you have to wait for your turn. I even tried panner butter masala and chilly paneer but seems just some other gravy. Fir biryani lovers spc in whitefield area this is indeed the best place.",4.0
Monalisa Dohare,https://www.zoma.to/pnlkGE,"Its quite near to my place. Good biriyani.<br/>The serve it on banana leaves, that makes it look very traditional Hyderabadi  cuisine. <br/>The biriyani is good as well as other foods.<br/>Good service. <br/>Satisfied... :)",3.5
Atul Gurale,https://www.zoma.to/exZprg,If you love biryani then this is the place you should try. I bet you can never hate or dislike their biryani. Just one word Awesome.<br/>Quality and quantity are above expectations.<br/>I love their biryani and would definitely recommend all biryani lovers to try it atlest once.,5.0
Aparna Srikantan,https://www.zoma.to/KoXxxA,"Starters were pretty Good , but not up to the expectations.<br/>Veg Curries were total disaster. Vegetarian pls do not opt. My NV friends were also not happy. <br/>RISK IT!!!!!!",1.5
Saurav Das,https://www.zoma.to/NnwglG,"Birayani here is something to savour. However, the spice factor is little on the higher side. Firday afternoon is severely crowded. However, if you still manage to find a place, dont forget to order for the Mutton Biriyani, if you really are into spice, then order for double masala. Rest of the menu is just a filler. Service is average and below. Tipping extra to a regular might ensure you a better place next time.",4.0
Kanchan Chakraborty,https://www.zoma.to/axmlRR,"It’s a very nice place to have spicy food. Meghana Foods is well known for their testy Biryanis but we enjoyed the other dishes too. You guys should visit this place for their Biryani for sure, the service is average and ambiance is good.",3.5
Sadashivnagar Sadashivnagar,https://www.zoma.to/ngbnNo,"The most AWFUL service at Meghana MARATHALLI you will ever come across. We were very excited to order at Meghanas keeping the hype about the same everywhere. However first of all they never answered the call for at least 30 mins and when they did the guy over the phone was so blunt and rude as if they are doing a favor providing us food. And when asked that you have to be courteous enough to speak properly he banged the phone. That was really really sad for such kind of upcoming brand doing this. We will never order here, they are not the only good Biriyani restaurant in whole of Bangalore.",1.0
Nikhil Malhotra,https://www.zoma.to/lGAEAn,"Very Good, infact the best Biryani in marathahalli.<br/>I tried their special chicken and fish Biryani. <br/>Both were very good. Not much spicy and quite flavorful.",3.5
Varsha Ghosh,https://www.zoma.to/gXkDnR,One of the best biriyanis I have ever had in my life! I tried the Meghana special Biriyani in which the chicken pieces are cooked in egg and the Boneless chicken biriyani which was on the spicy end but still yummy nevertheless. <br/><br/>A must try for every Biriyani lover! :D,5.0
Ami Bhat,https://www.zoma.to/EObLYL,"When we had been to the restaurant, we had totally enjoyed the biryani and basis the same, recommended home delivery for a house party with friends. The home delivery was a mix of veg and non veg starters and biryani. The same was a complete disappointment.<br/><br/>The delivery was on time and the order correct but the same was not labelled properly at all. There was total confusion on the same. The veg biryani and chicken biryani was just biryani rice without any vegetables or chicken pieces. (Not a single piece.)<br/><br/>Will definitely not be ordering from the place again .",3.0
Shaheer Shahab,https://www.zoma.to/NnkEbz,"It's actually hard to differentiate between the taste of so many of these Andhra joints. Anyways, this place is no different either. Good food, nice biryani (like every other place). Although there's nothing xtraordinary to crave about it or make you especially visit this place. If you are close by or want a change from your go to restaurant, may be give it a try. It's a safe bet.",3.5
Suman Sourav,https://www.zoma.to/raxYyE,"Before you start going through all the reviews I would kindly request you to note one point. Please do not have anything before visiting this place if you dont want your food to be wasted. I had one lassi and then ordered for a biryani and even before having the half of the biryani both my stomach and my body gave up. A good example of quantity with quality. The biryani tastes great and not just non veg ones, but even the Veg paneer biryanis. ",4.0
JayaChandra Vissamsetti,https://www.zoma.to/wqPMPP,"Brilliant spicy food is the short answer for this restaurant. We were at this place on Friday afternoon around 12:30 PM, at 1 PM this place became very crowded and people are fighting for tables, despite 2 floors and lot of tables. Food taste is good, proper andhra restaurant with lots of spices and chilly, don't forget to order lassi or sweet lime soda when you go to this restaurant.",4.0
Sudeepth Kumar,https://www.zoma.to/qZDpdL,"Ordered biriyani and naan but the time it came lost the appetite. Anyway managed to take the first bite and found was cold i mean what were they doing then for so much time.When asked waiter and manager address due to AC the food might have become cold but if observed the AC wasnt working only.Service was worst even tge road side food huts give a better service. And the most important part was still to happen, after completing the food we were gossiping and the waiter comes and asked us to leave since he had to leave and that table was under his region so he cant leave until the table is empty. I felt so embarassed infront of my guests didnt want to even argue with them at that moment . Anyone who reads this plz dont visit this store. I am a food junkie and always prefer to try at various places but if compared to the meghna outlet and koramangla and at marathalli its like 10 : -10.<br/>Its really the worst food outlet visited in the last 6 yrs of my stay ay bangalore.<br/>Never recommend it to anyone .",1.0
Tapan Kumar,https://www.zoma.to/exYQLA,I had biriyani at meghna foods koromangla but here it is quite worse. Service is more worse than expected. If u are looking for authentic biriyani visit koromangla venture. This is my second visit to marathalli store and its worsened from the earlier visit. Plz don't go here look for other options.,1.0
Venugopal Reddy,https://www.zoma.to/MeKBzw,I felt the worst ever than any restaurant.... Service is really poor.....Food got worst taste compared to other Meghana restaurant.... More over that they charge extra for Raitha.....I never suggest anyone to Meghana Marathalli.....if I can rate '0'....I would like to rate....,1.0
Ajay Raj Achary,https://www.zoma.to/DqGrOL,The food was OK...But the service was worst..No AC   turned on n they charge service tax for what....<br/>This would be the last restaurant I would wish to eat....,1.0
Chaitanya Shroff,https://www.zoma.to/EOoEgN,"For starters, this is the place which made me fall in love all over again with biriyani. Not that I had not liked it before, but the place in Koramangala first then this one after my office shifted made me like it even more. It is a large place with two flights of stairs and it all smells nice when you enter the place. Only problem is that even on a weekday afternoon, it'll be jampacked and need to wait for a while to get seated. Coming to the food now, I like kalmi and chicken 65 here. They are my favourite chicken starters. Another thing I like more is prawns fry. We have been here like four times on different occasions and have always taken chicken boneless biriyani. The spice mix is really yum and goes reall well with the evenly cooked rice. Over the time though, the quality of biriyani rice has gone down and makes it more harder to complete one full pack of it. The service is pretty zippy and price is moderate. Always check the daily specials here, they usually are good. If they can get more consistent over the quality, then the time spent here can definitely be more satisfying and worth the wait. ",3.5
Shabnam Asif Anwar,https://www.zoma.to/zmaqoR,"Pick, go and eat... I ate it alone but still enjoyed ... I Loved the Biryani! - Tried 'Chicken boneless biryani'... The raita served alongwith was equally good.",4.5
Shruti,https://www.zoma.to/xOnree,"Meghana Foods certainly lives up to the hype and offers a wide range of Andhra delicacies and some kick-ass biryani. I've tried Meghanas at two other joints in Bangalore but I've never really enjoyed it. The Marathahalli outlet was successful  in changing my views altogether.<br/><br/>So, a friend and I took a break from work and were starving by the time we entered Meghanas. We ordered a chicken boneless biryani and a sweet lassi and sweet lime soda for drinks. The boneless biryani is really something else. You need to try it to believe it. The chicken pieces are tender and it's just the right kind of spice - the kind of spice that doesn't overpower the taste of the rice and the chicken. We found that the quantity was slightly insufficient for two people and decided to go in for another round. The sight of another big bowl of fresh, hot biryani brought out the gluttons in us and we ended up devouring the whole thing with raita and onions, in less than 10 minutes.<br/><br/>We paid Rs. 460 for two biryanis and two drinks and got ourselves a good deal. Service was prompt and the servers were also courteous. All in all, a great place for some really tasty food. Definitely going back! :)",4.5
Kalyan Kumar B,https://www.zoma.to/axapEE,"I have been to this place several times with friends and team members. Huge fan of the non-veg starters here- especially Kalmi kabab. I have heard that the veg starters are decent as well. Chicken biriyani is good, although a little bland( but you can always ask for extra masala). It is extremely crowded even on weekdays, but service is not bad at all. Best part is - they serve the food on banana leaves!",3.5
Soumya,https://www.zoma.to/exkryx,"Reached here for a Sunday lunch but it was so crowded that we decided to order takeaway.<br/>Ordered 2 boneless chicken biryani and the quantity is good.The chicken comes in a different packet.It was spicy , well flavoured but nothing different from some biryani places.",3.5
Sudeshna Roy,https://www.zoma.to/Koyqgb,"I ordered butter chicken and naan. It was not good. In butter chicken, the pieces of chicken was brunt black from one side and the gravy was very oily, not good either. Each of the naan was of different shapes of triangle and half circles, never saw a restaurant like this.",2.0
Amit Samal,https://www.zoma.to/YxMxyG,"Awesome food, really loved the meghna special biriyani, a must visit place, but do keep in mind it's quite crowded even on weekdays as most of the offices nearby flock here for lunch treat. ",4.0
Reuben Benjamin,https://www.zoma.to/ngDkMb,"I had visited this place in its first week of opening, and again this week. There has been a visible change in food & service.<br/><br/>Just based on my earlier experience I would've certainly rated it 4.0 or 4.5. Their biryanis were really good back then, really rich & even the quantities were generous. Even their service seemed a bit more professional, and significantly more than most neighboring Hyderabadi biryani joints.<br/><br/>But this time my visit wasn't all that great. There wasn't anything wrong here, just not the same standard I'd walked in expecting. The biryani seemed quite bland for Hyderabadi biryani standards & the serving size was visibly smaller. I also tried their signature Guntur Chicken & Lemon Chicken. The Guntur chicken was quite rich in flavor. The Lemon Chicken wasn't all that great though. It just seemed like regular friend chicken nuggets, only spicier.<br/><br/>I hope they return to their earlier quality & quantity. I'm sure they'll get significantly higher reviews when they do. And I'd be glad to adjust my ratings once that happens.",3.5
Abhinav Prakash,https://www.zoma.to/GmqmXn,"Are you a Biryani fan??<br/>You are at the right place. Chicken boneless biryani is superb here. In addition to these, I have tasted two starters here; Chicken 65 and Chicken Pepper...both were okay.<br/><br/>Ambience is just okay.<br/><br/>P.S: Parking is a problem here, so you need to park at the service road, make sure it's not a No Parking area.<br/><br/>Enjoy the biryani :)",3.5
Gnapi Reddy,https://www.zoma.to/raPRag,"Pakka andra style restaurant... When ever I think about this restaurant my mouth starts oozing...? food is that yumnnnn!!!! Especially  Meghana special biryani , fried fish, Guntur chicken, n bangalore special chicken.... I'm in love with this restaurent",5.0
Shiva Borusu,https://www.zoma.to/gXQyep,Tried this just for a visit. Their lollipop biryani is awesome and a must try. The Apollo fish fry is good. Average ambience and overall a good restaurant based on Marathahalli.,4.0
Nisheeth Jain,https://www.zoma.to/wqapzG,"I always love the biranyi here..whether be it chicken boneless or Meghna specially..at both the layouts I had, i.e. Kormanagala and marathalli. But the bad ratings for the services and low courtesy of the staff at Marathalli outlet. So better if you want to have food from here, just get it packed and take home which will save you from their bull***t behavior.",2.5
Gajanan Hegde,https://www.zoma.to/NnKXzz,Awful Experience . If you are a pure vegetarian don't go there. <br/>We have ordered veg Manchurian . But whatever they had given had some chicken pieces in it . I think they don't cook veg and non-veg separately.When we asked about this they were telling like somehow it got mixed . <br/>Food served also not very tasty . It was oily<br/>So please beware if you are a vegan,1.0
Gyanapriya Sarangi,https://www.zoma.to/RBzLPQ,"Apart from the biriyani, the other dishes are also up to par. They are well-prepared and you can see a little bit of reservation in terms of spice and oil usage.Flavors are pretty well balanced.<br/><br/>Not extravagant, but good food.<br/>Service is okay even on busy days.",3.5
Amith S Bhat,https://www.zoma.to/MeBnqB,"Being a vegetarian, I wasn't particularly Keen on this one since they serve only 2 types of vegetarian biriyanis(veg and paneeer). Oh man, I was so wrong! The veg biriyani served here changed the very perception of biriyanis. The best I've had till date. The other items on the menu don't stand up to the mark, but hey, who cares as long as they serve that piping hot, incredibly spicy, delightful biriyani with a thick raita and masala gravy. I've heard from my non vegetarian  colleagues that meghana special is pretty darn good too. Beware though, huge crowds of IT people will be thronging the restaurant any given day and might take some waiting to get a table. ",4.0
Siddharth Jain,https://www.zoma.to/xOdemv,One of my friend took me once. We ordered one biryani and believe me it was more than enough for both of us. We somehow managed to finish it. But it was very tasty. Overall one of the best biryani in town and it is well known. Ambience is simple and service is good.,4.0
Kirti Avinash,https://www.zoma.to/gXQlRG,"I had heard a lot about this place but had never tried it. And one day I landed along with my friends. We ordered the famous special meghana chicken boneless biryani, and it was awesome. I really liked it, its bit different than usual biryani's but its wow. I would seriously advice you to try once. ",3.5
Himanshu Choudhary,https://www.zoma.to/OZkaZY,"Chicken and fish biryani are good. But avoid paneer biryani here, two of my friends had vomiting after eating it. Lassi is always good here.",2.0
Ashutosh Tibrewal,https://www.zoma.to/wqoNGG,"It doesn't have great ambience but got some decent biryani. If you feel to try some andhra biryani this is the place. The paneer in the biryani where soft, huge in size and quantity. The biryani had lots of panner.",3.5
Abhi,https://www.zoma.to/wqoRnG,Chicken Boneless Biriyani. <br/>Really yummy  with juicy tender pieces of spicy chicken. One dish you should order here without having to glance at the menu.<br/>Trust me!!,4.0
Avinash Jobs,https://www.zoma.to/exnGnK,Sorry to say that got veg in chicken biryani. If veggies get chicken in veg biryani. How they feel .....i felt the same .no words to say this experience,1.5
Nimish Joshi,https://www.zoma.to/ABRmBo,A must visit for the Biryani. Will recommend both Meghana special as well as the spicy Biryani. Chicken 65 as well as Silver chicken is worth a try.,4.0
Umang Bhatia,https://www.zoma.to/ABaPzz,"The most pathetic food I have ever eaten and I was shocked because all my friends told me that the biryanni here is awesome. I had a chicken biryanni (home delivered) and suffered 2 days with food poisoning. Maybe they don't maintain the same quality for home delivery, I don't know, but I suggest everyone even if you want to try out the biryanni here ,at least dont  have the chicken of this place ",1.0
Chaithra Srinivas,https://www.zoma.to/BKYMqD,"People come here to eat biryani...  well I though why to order the usual biryani.  I tried there veg meals and took chicken starters. Amazing food they serve different kinda chutney  which was so yummy that it made forget all about my chicken, Being a hard core non veggie even there veg meals make me wanna go there again and again . The most important was the bill which was so light on my pocket that I can go soon.",3.5
Shilpa Mohanty,https://www.zoma.to/dxovaB,Superb biryaani..too tasty ? . A must try wen yu r in bangalore ?. The only disadvantage is poor serving facility. Else the food is toooo goood ! ,4.0
Avirneni Vhivek,https://www.zoma.to/zmenkk,Awesome experience with delicious food even in veg & non-veg.I had meghana special biryani I shows that its specifically made for me fabulous.even veggie is worth of price.enjoy Andhra delicious food with meghans,4.5
Puneet,https://www.zoma.to/OZEEkk,Brilliant .. a no fuzz place. Even while runnin housefull the food gets to the table in no time. Hot n tasty. Well what else can u ask for from a casual dine place. What more - food apart from their famous biryani is good too :),4.0
Aravind Jayeram,https://www.zoma.to/QYErMX,"Late on Sunday morning decided to try Meghana Foods after many recommendations friends and foodies. Was about 1 PM when I visited the place with wifey and my 1 year old son. Was shocked to see the crowd in there and and about good 25 people waiting for their chance to get a table. Thought it was a bad decision to come on this day considering I had a year old kid along with us.  We decided to go ahead and wait it out and have out lunch here.<br/>After good 15-20 mins wait, we were allocated table. Ordered for a Meghana Special biryani, Chillie Prawn fry and a Mutton fry. Also ordered for a coke and lime-soda. After 10 mins, the waiter came and mentioned, mutton dishes are not available any-more and asked for a replacement. We quickly ordered for Naati chicken fry as we did not want to waste any more time with kid getting crankier by the minute.<br/><br/>Chillie Prawn fry was good. Naati Chicken Fry was below average. Meghana Special Biryani was very good. The lime soda never arrived until the end of dinner after requesting the waiter few times. <br/><br/>Rating 3 only for the Biryani and pricing. Ambience is nothing great to talk about. Service is again average (I would think this might be due to being a Sunday and over crowded).<br/><br/>I might again go just for biryani and definitely not with my young son and not on a Sunday as well.",3.0
Somen Mohanty,https://www.zoma.to/KodzRQ,"I had high expectations from this place knowing the quality of food meghana foods serves in different places. But was a bit disappointed with how things went here.<br/>The service was average, the food quality and flavours were not at par with other outlets. Banana leaf serving was a very good addon to have.",3.5
Veera,https://www.zoma.to/raAmbM,"Its disappointing , didn't have a home delivery facility...I call them for a home delivery after seeing in zomoto..they asked us to come and collect the food...",1.5
Gautam,https://www.zoma.to/ZxyZZe,"Went for a dinner party. The ambience was not superb it was just okay. Ordered Chicken Lollipop, chicken peeper, chilli chicken for starter. Only the Chichken lollipop was good and rest are bad in taste. Ordered special biryani for Main course and the taste was not superb and the cost is bit high as per the taste. And the surprise thing is only they have soft drinks for desert and nothing else. Coming to the service, It was good. So i don't feel good to have dine out here.",1.5
Raj Vardhan,https://www.zoma.to/OZAemn,A good place to have Biryani. Taste quality and price completely matches. Don't have lolipop or desi or normal chicken Biryani but boneless Biryani is good one. Go and have once. ,4.0
Preeti Gupta,https://www.zoma.to/bxXoxE,"Value for money.  Good to go when u have only food (to stuff in your stomach) on mind. It's tasty and hygienic (if they don't start brooming around while you are eating!). Most likely my experience of the simultaneous cleaning was a mere coincidence. By the way,  would suggest ordering boneless chicken items since I personally wasn't happy with the pieces they served in the chicken dish we ordered.  ",3.0
Jayesh Gajre,https://www.zoma.to/pnkPxv,"We went there on a Sunday evening, precisely when all the bachelors of Bangalore are out in search of a good meal. Since we were early in the game and reached this place at around 7, getting a place to sit was not a problem. If you plan to have your dinner here, make it a point to arrive by 7:30. By 8, this place becomes very crowded and you have to spend at least 15 minutes waiting for a table. <br/><br/>On to the location, this place is located right on the Outer Ring road in Marathahalli, hence, finding this place isn't a problem. Finding a parking space for your vehicle may be, especially if it has four wheels. You can park your bike right on the other side of the service road, but parking a car can make you sweat. Fortunately, there aren't many buildings on the Bellandur side of Outer Ring road, so you can find less-crowded spaces to park on that side than on Marathahalli bridge side.<br/><br/>The ambiance of this place is decent. Both the floors are air conditioned and seating area is decent. On hygiene front, it looks pretty.<br/><br/>We ordered Apollo Fish as a starter and one boneless chicken biryani & a mutton biryani in main course. The starter hasn't got a taste that would make you remember it for a long time. The quantity is fine. If you look at it from the hunger perspective, the biryanis are sumptuous enough to make you consider giving starters a skip. <br/><br/>On to the biryanis, they are the USP of this place, and rightly so. The taste is really good! If you are a seasoned biryani lover and haven't checked this place out yet, you absolutely should. <br/><br/>Mutton Biryani had succulent pieces of meat that were well-cooked and marinated enough.  Boneless chicken pieces were tasty too. <br/><br/>So where does this place miss out on a 4.5? Well, contamination and non-homogeneity of biryani rice. Allow me to explain.<br/><br/>Apparently, the chefs at Meghana were so happy with us that they awarded their own hair in the chicken biryani. That was a big turnoff. We were in no mood of fighting over it, though, as the waiter was extremely embarrassed and took away the whole biryani and offered a replacement. As we had already consumed most of it, we declined, and he didn't bill us on the chicken biryani.<br/><br/>On to the homogeneity of rice, you expect the spices of biryani to increase linearly as you tuck in deeper. However, a few lumps of spices were present somewhere in the middle with rice and with no meat. It leaves a weird taste in your mouth when a lump of a mixture of spices suddenly wrecks havoc! Gulps of water only partially soothes the hotness. <br/><br/>Overall, this place should be a little more vigilant on its process of preparation. However, as a die-hard biryani lover, I do recommend you to go this place. I am sure that the probability of what we faced is very low :)",3.5
