Author,Review URL,Description,Rating
Rashid Khan,https://www.zoma.to/RaKoyk,"I was in marathahalli this afternoon and wanted to have meals for lunch. I went to Kritunga but meals were not served there. So went to Meghana restaurant just few metres away from Kritunga. There was no specific parking place for two wheelers or four wheelers. The service road was used for parking.<br/><br/>I was received warmly when compared to Kritunga. I ordered meals and the waiter politely asked me if I needed any side dish with it but I said no because I was in the mood of having papads, chutneys and pickles.<br/><br/>I was served on banana leaf. The sweet was Semiya which I had before having my lunch. It was very tasty. Sambar and rasam were served in small bowls. They also served pulav in small bowl which i did not taste. Server came and politely asked for what curries I would need. I told him to serve a bit of everything. Dal with leafy vegetables, potato and bhindi curry (which was very spicy) and chutney were served. My favorite is chutney and it did not disappoint me. i asked for gun powder and was served with 3 jars containing gun powder, and two pickles. Rice was served and ghee was brought. I had rice with lots of ghee and gun powder. It tasted yummy. Dal was tasty but potato curry was spicy and I couldn't even have a bit of it. Overall the meals were on point and not many dishes were served without proper taste. I recommend Meghana not only for biryani but also for meals.",4.0
Dilip Anand,https://www.zoma.to/NgYkok,If you want to try some spicy authentic andhra food then this place is very good. sometimes on weekends the restaurant is heavily crowded and you'll have to wait apart from that only glitch everything else is awesome. They serve you food on the banana leaf which I felt nice.the biriyanis and their curries are worth mentioning.do try this place once and fill your taste buds with some spicy biriyani.,4.0
Ankush Bhattacharya,https://www.zoma.to/LGxrNb,"Went to this place on last weekend with couple of my friends. Biriyani was awesome. I liked the boneless topings they provided on the biriyani. But I did not like the mutton keema, lots of spice and curry leaves. I would like to taste some more items for sure.",4.0
Uday Bhartia,https://www.zoma.to/XOqGlO,"Place to go when you want good food (Biryani and Andhra meals).<br/>Their consistency is really remarkable. I am a frequent visitor and hardly found any problems with the food.<br/>Their service however, can improve a lot.<br/>The fish biryani and boneless chicken biryani are a must try!",4.0
Chandan Ku,https://www.zoma.to/znZdrb,I visited meghana 2 or 3 time. biryani was testy and spicy. You must try mutton or chicken biryani. Ambiance was very good. I also liked Chinese in andhra style. ,4.0
Sthitodhi Sarkar,https://www.zoma.to/enKZbn,"This review is just for their and Andhra style chilly chicken, because I've never tasted anything like that before. Be warned, this dish is strictly for hardcore spice lovers, as the gravy is nothing but green chilly. I just love it and Meghna gets full points to get this awesome dish to us.",4.5
Kiran Varanasi,https://www.zoma.to/aGNran,Have been visiting Meghana foods for the biryani for some time now. The biryanis - chicken and mutton were amazing. The food though spicy is super tasty. The overall experience was great.,4.5
Kumar Shanu,https://www.zoma.to/XOegdO,"We went for Sunday dinner, specially for Biryani. We got seat for 4 members easily, staffs well behaved. Food preparation was good. Had a great taste of veg biryani after long time. I would prefer to visit again.",4.5
Bibhudatta And Reena,https://www.zoma.to/aGNkOR,"Checked in this place today for dinner. For most of the Bangalprians, no need to mention, the name itself is enough.<br/><br/>We ordered Chicken Biriyani, Paneer Biriyani &  Mashroom Chilly. Biriyanis were really good. They fall in between high and low spicy. The Meghana Spl Chicken Biriyani is awasome. Mashroom Chilly was okok, nothing special.<br/><br/>Service, ambience, quantities were very good. I recommend this place.",3.5
Vishwanath HM,https://www.zoma.to/Yznnoq,Went for lunch on a Thursday afternoon.<br/>Was easy to get table since it was not Friday afternoon because all the IT ppl around will be looking out for lunch. <br/>Avoid on Friday afternoon.<br/>Meal was incomparable to Nagarjuna. <br/>Had ordered that day's special chicken dry which the waiter suggested and it was worse and priced too high.<br/>Only good thing about Meghana is its biryani. ,3.0
Swati Sinha,https://www.zoma.to/QZKKxY,"I had the best biryani in Bangalore here. Chicken boneless biryani. Yummmm. I am always ready to have dinner from here. You can always rely on the taste, it never disappoints you. Also the chicken starters are delicious. Just visit this place soon if you want to taste the best biryani in Bangalore. Even better than Paradise in my opinion.",5.0
Suranjana Chowdhury,https://www.zoma.to/LGmbbq,Their best dishes include egg chilly and chicken fried rice but their chicken biriyani totally sucks. It's too spicy.. In no time tears start rolling from ones eyes :p and the butter chicken tasted more like brinjal chicken.. interior needs more attention as there are a lot of mosquitoes(on rainy days). Staff behavior needs improvement.,3.0
Yash Gupta,https://www.zoma.to/LGmepk,"Known for its biryani, we ordered from here twice for delivery. Food delivery is relatively quick and the food packaging is very good, green bag fir veg and red for non-veg.The keema biryani and the Meghana 555 (chicken) is really good. Definitely try the different types of biryanis.",4.0
Vinay,https://www.zoma.to/MomeeP,"Meghana is the first word that strikes the mind to satisfy our Biryani cravings while it work.<br/>Needless to say about the Meghana Spl Chicken Biryani & Paneer Biryani... they are always delicious and to die for.<br/><br/>The food, packaging and delivery have all been good on all occasions, except a recent one.<br/><br/>We had ordered for 4 Spl Chicken & 3 Paneer Biryanis  2 weeks ago for dinner on a Saturday. We were in for a surprise when the food arrived. All the packets had Paneer topping and were not as per the order.<br/><br/>When reported, Manager of the outlet accused Us of lying and also that their CCTV footage showed packets of Paneer n Chicken toppings leaving their kitchen. Though We offered to show photographs and return the extra Paneer packets, He held his side saying the order was dispatched correctly.<br/><br/>After a lot of requests and convincing, He agreed to send the appropriate Chicken topping packets.<br/><br/>By the time We consumed the Biryani, it was 11pm and the food was not enjoyable.<br/><br/>We hoped to set aside this bad experience and ordered the same Biryanis twice in the last 2 weeks (including today) and We were happy that both orders were correct and the food tasted great as usual.<br/><br/><br/>",3.0
FoodMonster.,https://www.zoma.to/ygKPXB,The briyanis are really good - amazing portions! Food is a bit towards the spicy side and known for their biriyanis and andhra cuisine espl meals. Way too crowded and prefer home delivery!,4.0
Auryl Glenna Machado,https://www.zoma.to/KdlZrg,"Even after getting negative feedbacks of this place by my friends, I decided to give this place a try. I had fish for starters and meghana's spl chicken biryani. It was good. Though I don't like spicy food, I liked this one.",4.0
Anil Mankar,https://www.zoma.to/edNQDr,"Best biryani, less spicy. Been to Meghana in marathahalli. Nice place but heavy rush always. Tasty biryani. Need to improve on starters and meals.",4.0
Sandeep Reddy,https://www.zoma.to/rAYQwM,"Need to improve your customer care.Had been to the restaurant on Sunday night and has ordered biryani which was promptly delivered, i guess they have everything stacked up ready to serve.<br/>  Now for my kid wanted an omelette which was right there in the menu but the waiter out rightly said it cannot be done as it has to be prepared fresh. And the time was only 8 pm which is still not a rush hour.<br/>  So on sunday's they only serve items which are already prepared and kept like biryani's and other items.",2.5
Aditya Srivastava,https://www.zoma.to/kBGMbY,"A great ambiance,good service , Let's talk about food now<br/>Boneless Chicken Biryani -a must try dish if you go there.Also if you love spicy food try nati chicken curry,<br/>as for starters Chicken 65 is a delight and you can have some others too. I did'nt taste any veg items so i hav e no idea about it<br/>food -4/5<br/>service- 4.5/5<br/>ambiance-4/5",4.0
Janki Amrutiya,https://www.zoma.to/YEGklx,Pathetic place. Very bad service. No respect for customers. It was just plain rice with some frozen and tasteless paneer. They served chicken biryani without chicken. And the manager did not even care to replace it. I would not at all recommend this place for biryani. ,1.0
Shreyank Gowda,https://www.zoma.to/kBqLwy,One of the best places to have biriyani without a doubt! The must haves are the boneless chicken biryani and obviously their meghana special biryani. Barring that most starters are average. Didn't really like the golden fried baby corn. The chilly chicken is decent. But just for the biryani this place is a must visit!,4.0
Aneesh G,https://www.zoma.to/BYOzqD,"I recently visited and took prawns biryani(take away) on 4th August 2016 evening. I ate many times the same prawns biryani and it used to be good. Last time i took biryani and i couldn't complete the biryani. After eating a little only my upper throat started burning due to heavy masala(i am not talking about spice). The masala was too much, i threw it in the middle. I donno why they have added so much masala. And they charged me 306 rupees for this. Next day morning i was able to feel that throat burning whole day. And finally i got cold and fever. It's like i paid 300 to get my health upset.🙏🏻",1.0
Swati Mishra,https://www.zoma.to/EkdXdN,A pretty decent restaurant with humble interiors. As for food we ordered<br/>1. Chilly Prawns (4/5)<br/>2. Mixed Fried Rice (4/5)<br/>3. Chicken Boneless Curry (3/5)<br/>4. Egg Masala (4/5),3.5
Shayan,https://www.zoma.to/NdzNXX,Had lot of expeactations from  dis chain of biryanis.To my uttr disppointmnt...d biryani they serve wsnt up2 d mark.Being from kolkata....i alwys had an inclination towards mild dum biryani.In meghna wat dey serve is (spicy)^2 biryani.In other words its 2 spice with all dos flavours of pickel comng out of it.In all a pretty bad experience 4r me.,3.0
Justfood (Keerti Pratap Singh),https://www.zoma.to/ZyqEGl,"Meghana foods ante Andhra Cusine ante my love. Yes I love Andhra food and when it comes  to eating Andhra food in Bangalore, Meghana Foods is one of the joints where I love to go. Though I had visited their Kormangala outlet also but their Marathahalli outlet is much better in terms of seating and ambiance.As far as food is considered, I always order meals and biryani. And it is rocking here.Will surely recommend this place.",3.5
Debalina Dhar,https://www.zoma.to/OEGRgY,"Good taste, but the quantity is too low for the chicken ! Also the size of the chicken pieces are too small! Otherwise everything is awsome! Suranjana Chowdhury Rimlee Tat Tanima Halder Swati Mishra<br/><br/>My subsequent visit has not been very good. The biriyani is always too spicy. ",3.0
Pradeep,https://www.zoma.to/kBzmoQ,"Meghana foods is famous for Biryani. U have an option to be served on banana leaf as well.  We tried Chicken biryani boneless , Paneer butter masala and roti. All item were super in taste, quality and quantity. Only problem is to get parking space on weekend. Worth to visit again. ",4.5
Gulshan Budhwani,https://www.zoma.to/PPOqeK,Boneless Chichen Biriyani is one dish you should definitely binge on at this place. All chicken starters are good. Ambience and seating arrangement is good. ,4.0
Debleena Bose,https://www.zoma.to/MEyrQE,Biryani served in banana leaf is just too amazing. Spacious compared to other outlets. But ofcourse u still won't get a space to stand anytime you go. Food taste is always yummy! ,4.0
Aditya Shankar,https://www.zoma.to/nqYQPy,"Meghana's special Biryani is something which can always uplift your mood. On weekends its mostly crowded(waiting time close to 30 mins), but during weekdays one gets place easily. Drinks prices can be reduced. Over all a good place to devour all your Andhra hunger pangs.",4.5
Abhilash Anand,https://www.zoma.to/XNpgaM,"Paneer biryani, mutton biryani and Meghana special biryani is what we ordered. And satisfaction is what we got. This place is usually full and aromatic. The food was good and got even better when it arrived on time. The Meghana special biryani was a bit disappointing though. Overall an okay place. Give it a try. ",3.5
Vinodh Kumar,https://www.zoma.to/nqpmXb,"This is another out let that I visited and they suprise me with the same taste every where.<br/>The spices, quantity, quality...etc everything is perfect and it stays till 3 am that amazing <br/>I love it.",5.0
Sai Satish Varma,https://www.zoma.to/LbllGK,This is always our regular Adda for us to hang out with Friends. And the Food is decent and also within Budget unlike so many other restaurants in Bangalore. Always loved the Biryani here. And the Starters. ,4.0
Sauvik Kar,https://www.zoma.to/OEDQdM,"Delicious - One word to describe this restaurant. The moment I entered the place, I was awe-struck to see so many people in waiting just to get a taste of the dishes, that too on a normal Sunday afternoon. The huge crowds at the entrance made me realize that something must be very right with way the managers are running this restaurant. It is a perfect example of a restaurant that has nothing to boast of except its food quality and most importantly the taste that it offers. We ordered Boneless Chicken Biryani (quantity is good enough) and it was no doubt ‘really yummy’.<br/><br/>Some negative points for the ambience, however, the overall food experience being top notch, I would go with 4.0/5.0 for Meghana Foods(Marathalli). Definitely, a must go restaurant if you want to have one of the best Biryani’s in Bangalore.",4.0
Nitesh,https://www.zoma.to/aMdAmE,"I went for lunch with my friends. I parked my bike in front of Meghna Foods. We had lunch and came out after 30 minutes. I searched for my bike but was not able to find it. I asked security guard, he told that it got towed. There wasn't any ""No Parking"" sign board and also guard did not inform me about this during parking. I went inside restaurant and asked manager for the help. He told me that I can go to towing van and ask them to release my bike by showing the bill. They will not take any money and in case of any problem I can call manager. I searched for the towing van and did the same but towing policeman was not willing to release bike without money. I called meghna foods and asked them to talk to policeman. After five minutes of conversation policeman put the phone and again asked for money. Now I called again and asked to give phone to manager but service people did not let me talk to manager for 10 minutes saying that he is very busy. After that they told me to come back without bike or wait for some more time. The overall response of the management was very poor. I felt helpless and had no option other than paying money to policemen to get my bike back. <br/>Worst experience ever with management of any restaurant.",1.0
Ravi,https://www.zoma.to/aMQeRg,Being a chain taste is good... But will advise to order as they are available in app. and eat rather then planing to go and have...  Space is issue and dnt look hygienic ... Service is ok ok not too fast... And if u need parking then it will b issue... ,3.5
Avik Niyogi,https://www.zoma.to/mkQOxX,I had placed Nati chicken biriyani for order for the 6th time by Swiggy and everytime it is not available. They should not confirm the order if the item is not available or they should remove this item from the menu for delivery if it is not available always.,2.5
Umesh Krishnamurthy,https://www.zoma.to/OEezNv,Amazing biryani.. Pieces were juicy.. Fish was was also good.. Worth the price... Will be back to try other dishes.. Just extending the review to cross 140 characters..                                                  ,4.5
Aswin S,https://www.zoma.to/aMGnDo,Nice place for all kinds of foods...especially biryani....nearby to many hotspots...so it attracts many IT people and tourists and families.,4.5
Nandhini Priya,https://www.zoma.to/wGodvD,"Ordered Briyani for office party, one briyani pack was missing and when enquired about it no body was responding properly. Bad delivery :(",1.5
Kiran Kumar,https://www.zoma.to/mkObpy,"Please don't  order for home delivery. I should have listened to the other reviews that mentioned the same. We had ordered for 5 Biryani and it was delivered after 2hrs. But the worst part was all the Biryani was very salty. We had to throw it as it was not fit for consumption. We then called the branch who asked us to call the manager. Manager informed that we will be getting free complimentary Biryani's.  But the next time we called him,  he didn't pick our call. Sad that a branch which take charge much for each Biryani give such pathetic quality and service. I am afraid to order from this outlet again! ",1.0
Aurodeepta,https://www.zoma.to/xoowbP,"Have been to Maghana couple of times. Had chicken biriyani once and the other time Maghna special biryani. Chicken biriyani was okay however I liked the taste of Maghna special biriyani somehow. Avoid going on Friday lunch time, very much crowdie you may have to wait for more then half n hour.",3.0
Triyambak Tripathy,https://www.zoma.to/DKKyab,It's a overhyped place for Hyderabadi biryanis but it's not upto the mark. The biriyani and the courtesy was pathetic . Doesn't stand for a completion against Biriyani zone. ,2.0
Siddhant Malik,https://www.zoma.to/kBZwBX,"We went there for a team lunch. We ordered for meals, meghna special biryani and normal chicken biryani.<br/>Taste was pretty average with nothing much to complain or praise about.<br/>Seating space is cramped and needs some improvement.<br/>Prices for drinks are bit on the upside though.",3.0
Shreya Misra,https://www.zoma.to/LbOXND,"We had ordered 3 chicken biryani , first of all there was not a trace of chicken in any of the dishes. Not a single piece of chicken.Very pathetic service. Secondly, the delivery guy doesn't deliver it at your doorstep and instead asks to pick it up from a nearby landmark.Please do not order from this marathalli branch of Meghna foods. Horrible is an understatement.",1.0
Prathyusha,https://www.zoma.to/xoNewZ,"Visited this place with teamies on their recommendation.  Its a proper andhra cuisine and always packed.  The aloo dum biryani was very delicious,  the spicy level matched my taste. My friends couldn't handle the spicy level,  so always good to order a lassi or buttermilk to calm ur taste buds after they go on fire.",3.5
Nitish Sahoo,https://www.zoma.to/rAGYZa,Delicious food that you ever imagine about. Quality of food is maintained throughout their franchises. Ambiance is not quite very good to make a point. But you will enjoy an average Ambiance. ,5.0
Anupama Singh,https://www.zoma.to/BYXzAP,I often order food from Meghana. Its boneless chicken biryani is just yumm. According to me its the best biryani in bangalore. Have also tried the Paneer Biryani and Mutton Biryani which are both decent.,4.5
Amruta Dash,https://www.zoma.to/QEYRZY,"Good biryani variety. A la carte is also good. But we generally go to have their biryani as it is better than other things. Ambience is also good. Friendly staff as well. All in all, a good experience.",3.5
Harish,https://www.zoma.to/pznPew,Worst Meghana special Biryani.i din't eat that such like Biryani ...................................worst....................................,1.0
Gourav Mahendra (GouravFoodie),https://www.zoma.to/PPMPqe,If u r looking for authentic hyderabadi biryani then Meghana is must recommend .<br/>Food is spicy but yummy at same time.<br/>For veggies panner biryani is most recommended.....,3.5
Satya Das,https://www.zoma.to/nqOAam,I liked meghna social biriyani among all the biriyani special hotel around marathahalli . Service was quick ..less wait time in peak days ..Meals also good to try in case u don't like biriyani . Curries are spicy and oily . My rating only for service and biriyani ..,4.0
Pabitra Ghosh,https://www.zoma.to/edebXE,Ordered chicken biryanis from them and they were average in terms of taste. Nothing noteworthy to be mentioned here. Not much of a fan of their side dishes also.,3.0
Purnendu Patra,https://www.zoma.to/zewoyn,Not worth spending money. 250 RS for mutton biryani and the quantity is not enough for even a small kid. Biryani zone is lot better. Not recommended for home delivery. Would not dare trying at the shop.,1.0
Prateek,https://www.zoma.to/GOpaNX,"I am a vegetarian,hence could afford only veg varieties of Biryanis here.<br/>I had the Biryani once at the restaurant(Paneer Biryani) & other time(Dum Alu Biryani) via delivery.<br/><br/>If you are going single to the restaurant on rush hours than you won't find a good place to sit.The place they provide would hurt your dignity as a customer.They have two floors ,so for single person on first floor you would get the place right in front of stairs ,so that everyone coming up can stare at you.<br/>On second floor,they would give place near there kitchen,so that all the staff & commotion you get free with Biryani.<br/>I would suggest them to think on this matter.You shouldn't scale up if you don't have if you can't take care of your customers.<br/>Service was reasonable taking in account the heavy rush,it seemed you have to struggle to get attention of the staff either for food or bill.<br/>Biryani was delicious & aroma of spices in the Biryani assured you of authenticity.<br/>For my taste the hotness level was bit higher but it is expected as it is a Andhra Style restaurant.<br/>Potatoes in Dum Alu biryani were too salty.<br/>I would suggest to tone down the salt quantity.<br/>The minimum order is Rs 600.It would be unfair to someone who is ordering for a single person.They should make some arrangements for delivering food at lower value.",3.0
Rodricks George,https://www.zoma.to/nqZRbw,Good food but below average ambiance. Waiters don't know how to be polite with customers. Few of the items  are good but at the same time few are below average. Over all a good restaurant.,3.5
Srinived S,https://www.zoma.to/REdOGl,A very bad experience with Meghana foods for the second time. They failed to deliver what I ordered for. They billed me for the items but did not deliver. When I called them they were extremely rude stating they had delivered what I ordered. Definitely Meghana foods needs better customer service.,1.5
Raunaq,https://www.zoma.to/QEDalq,I come here for only one thing. Boneless chicken biryani! It is the best biryani in bangalore according to me. Taste is almost always consistent. Have tried their a few chicken starters. They were decent enough. I come here atleast 3 times a month and i never go out unhappy.,4.5
Pradeesh Kumar,https://www.zoma.to/YEDmda,The biriyani is worth the money.. The ambience is average coz the place is mostly crowded and the service time is average.. But if you are looking for some tasty food regardless of other factors.. Then this is a good bet. ,3.5
Lavin Sambhi,https://www.zoma.to/ZydAez,"One of the finest Chicken Biryani in bangalore very reasonably priced and awesome taste 👍 thumps up form my side must try , they also have an outlet in MG road superb 😊. Must try in bangalore 😉 ",4.5
Sanjay Kumar Verma,https://www.zoma.to/BYnnne,"If you are a Biryani fan, then you should definitely try out this place. I had dinner with my friends here. We ordered Meghana Special Biryani and Mutton Biryani. The Mutton Biryani was amazing. The other one was also pretty good. Overall a great Biryani spot.",4.0
RAJA NARAYANA B.V,https://www.zoma.to/lKnRxy,Too spicy with misc spices.Place is not as good as expected.staff is too hurry and not trained. If they can cope it up they can reach the heights. Recommend to go with take aways ,3.0
Varsha Anandani,https://www.zoma.to/mkElgQ,"Best biryani in Bangalore, no doubt, yummy spicy and that flavor. Also the yummy and spicy starters. I have been here multiple times but never get bored of Meghna's special chicken biryani. Must go place.",4.5
Arpith Jagannath,https://www.zoma.to/DKbyYb,Being on the ORR makes it a hotspot for techies to have some nice food. Can get a bit crowdy during lunch hours. So the early bird catches the seats easily. ;) Good food and a great place to have a nice hearty meal with friends.,4.0
David Thomas,https://www.zoma.to/wGylng,"A good place for Andhra cuisine. Queue is mental. Worse than the check-in line for Air Asia's flight to Bangkok. Nonetheless the food was good. Went in a group of three. The Meghana special biriyani was a bit of an overkill, I felt. It was spicy masala, spicy masala and more spicy masala. Boneless chicken biriyani was excellent and the pepper chicken was very good. Kudos to the waiters for managing the crowd. The team should be named courteous event managers. <br/>(Disclaimer: Taste is subjective)<br/>Vipul Verma Rajan Punatar ",3.5
