Author,Review URL,Description,Rating
Ashoka Ananda,https://www.zoma.to/eLROdp,I ordered home delivery meganaspl birayani. Fish fry and megana 555 very taste very fast delivery good and very good service Andra style hunter chicken in Meganafoods Marathali,4.0
Dhanush Shettigar,https://www.zoma.to/bAdpZO,"Just love the Meghana’s special Biriyani and Chicken Pakoda !! Amazing taste , bit expensive but affordable one ! Must visit place ! Also must  try the Meals ",4.0
Arun Gurung,https://www.zoma.to/LqLGZN,I am eating for boneless chicken biriyani and<br/>Ckn 65 started in 2nd time that is very good test and good quantity<br/>That place and receiving also good.<br/><br/>,5.0
Vidhu Ranji,https://www.zoma.to/ZpAqBG,"Had a worst experience today ordering from this outlet. We placed our order at 8.50 and until 11.20 no response. When called the delivery guy, he was very irresponsible. When we called meghana foods Marathahalli (from the restaurant where we ordered) the guy said in next 20mins the order will be delivered. No luck after 20mins. Called the restaurant continuesly and none of them responded. Worst service ever!",1.0
Sneha Simon,https://www.zoma.to/DepQLE,I had heard a lot about this place and gave it a shot few days back in Marthalli branch..<br/>The food was good but nothing new to look forward to...We had ordered a fish and paneer biriyani..<br/>Both were good but I would say I would vote for fish more...<br/>One thing which made us uncomfortable the entire time is the service staff..They are very rude especially the manager that many at times we felt like walking out...<br/>Food - 4/5<br/>Service - 2/5<br/>Ambience - 2/5,3.0
Muralu G,https://www.zoma.to/bZQBvA,Visit this place for the most awesome biryanis. I just love its biriyani be it non veg it tastes awesome.Quantity is very good. Very quick service,5.0
Karthik Yadav,https://www.zoma.to/YwmKlr,"One of the best biryani place , even though the place is crowded all time they serve food reale quickly. The chicken boneless biryani is quite awesome",5.0
Mchinnappa Chinnappam,https://www.zoma.to/QlAyPR,Mutton briyani taste was very tasty and the spl fish fry is good and the service is good and good management.......hygienic also good and briyani was amazing... ,5.0
Anusha,https://www.zoma.to/OmzAGY,All food varieties are very tasty in this meghana foods grand. Once in a week I will visit this restaurant to taste this awesome food.Mostly I like biryani but other food items also very tasty. So I like different food varieties also in this restaurant .,5.0
Fakrun Nisha,https://www.zoma.to/ZpwXvz,"Trust me ..this restaurant is one of the best in marhathali ,<br/>Briyani ki taste aahh can't explain .<br/>Behaviour or staaf is also satisfactory..<br/>Neat and clean and maintained hygiene..",5.0
Hemanth Potla,https://www.zoma.to/BoGXLv,Very nice place . The setting is very different from all other restaurants. The quotes all over the walls are very funny and enjoyable. The taste of the food is too yummy. Mainly the buttermilk mmmmm☺️ really tasty. We will feel like having more and more.,5.0
Nagendrababu Chow's,https://www.zoma.to/lAOywX,<br/>a week ago<br/><br/>Nice place for food lovers who love to have speciy food this place is full always as it's a small place and provide tasty food. Nice hygienic place. Expect few deep fry items remaining all good taste good quality and good price. Nice<br/><br/>,5.0
DUVVURU SAI HARISH,https://www.zoma.to/vpEDpe,Very tasty mutton biryani was very spicy and tasty and the ambience is good. And the service is good the Meghana chicken 555 is very good...<br/><br/>,5.0
Milan Bohara,https://www.zoma.to/nbmAPQ,Good briyani in banglore and good dlivery meghana food and I went to the resturant and the ambience is good...and the food is very tasty and spicy<br/><br/>,5.0
Uma Shankar,https://www.zoma.to/xrwEmw,"We tried Meghana for the first time with the team and the food was great, freshly cooked very tasty and well presented. The waiters were attentive and service overall was very good. The restaurant looked to have been recently decorated. ",5.0
Thejaswi,https://www.zoma.to/gkYbeR,"Food - 4 food is tasty and spicy , ambience - 2 the place is not very great to sit and eat it's a bit conjusted but the food s great for a take away or home delivery... We have tried special veg biriyani which comes with Raitha and veg gravy - the quantity is huge and taste is awesome..<br/>Fish biriyani and chicken biriyani was also great.. over all a good place for biriyani take away...",3.0
Subbu Balu,https://www.zoma.to/eBLMaK,"""A wonderful restaurant Megana Foods marathalli Megana special Biriyani is very good combination with leg roast and very good speed of service very nice place "" ",5.0
Ben Noble,https://www.zoma.to/mlNpEz,"Their boneless chicken biriyani is the best. I've not had better ones anywhere else. Apollo fish is nice as well. I was only disappointed with a few flies that found the biriyani aroma irresistible. Although, they could never get any close to my biriyani. I had a workout while eating....swaying my hand back and forth. ;-)",4.0
Jayachandra Jai,https://www.zoma.to/qxopQY,I ma fine dining in megana food's marathalli is very good place and wonderful biriyani's<br/>I am ordering in megana555 is very good taste<br/>Again and again going to that place me and my family......... Keep it up ,5.0
Ashirbad,https://www.zoma.to/AGGXgB,"We had a birthday party and we ordered paneer tikka, mushroom masala, tandoori roti and butter naan and paneer biryani and slat lemon soda. We had a pathetic experience with this restaurant. Found hair strands in the tandoori roti while saying we have not got any response... Lemon soda was served with spoiled lemon juice which we asked to replace and after argument he did it. Only thing we liked was paneer biryani. This I never expected from a famous food chain.",1.0
Kumar Harsh,https://www.zoma.to/AGGgwA,They are not providing orders correctly....how can u say that in Banglore Whitefield area is dangerous (delivery boy).???????? U could have arranged some other members to deliver. It's very unfortunate to order something from a good restaurants n getting a feedback like we are cancelling your order.its very sad this was not expected.,1.0
Sanjay Khan Nagra,https://www.zoma.to/DeeoOk,"Ordered Boneless Chicken Biryani, Butter Chicken, Egg Curry, Rotis, etc. Boneless Chicken Biryani was the only good thing -- and historically, has been the only good item Meghana has to offer. 4 rating is only for that. Everything else is 3 or below. ",4.0
Sudha Kannan,https://www.zoma.to/kdoMoQ,"I was never a BIRYANI fan. Though I tried veg Biryani (may be pulao) at most of the highly reputed places in Hyderabad, nothing felt impressive.<br/><br/> Been to this place with friends and had to eat veg biryani. Thankfully it wasn't disappointing at all. <br/><br/>In fact, felt so good that I had biryani continuously for 3 days at this place. <br/><br/>The biryani was spicy, hot, tasty even no matter what the time <br/><br/>Coming to value for money, they offer good quality food at an affordable price and service is decent. Overall experience is great. <br/>",4.0
Mona Tejeshwita,https://www.zoma.to/GaemEl,Always lands up here if having biryani cravings... decent food with average ambience and services..paneer biryani was different than chicken one...,4.0
Sourav Prosad,https://www.zoma.to/zoPvDl,"When I was in Bangalore, I visited this place twice. <br/>First time one of my collegues introduced this place to me. Second time, I went there with one of my friends. <br/>I had Apollo Fish, Chicken Biriyani,  Chicken Boneless Biriyani, Mutton Biriyani.<br/>I loved Apollo Fish. It tasted good. A bit crunchy. <br/><br/>Now lets talk about Biriyani. This is the one of the finest Biriyanis in Bangalore. I personally travelled throughout India and tried different Biriyanis from North to South, from East to West. <br/><br/>The biriyani is of Hyderbadi style. The chicken as well as the mutton were properly cooked. It tasted very good. And the quantity is also good. If you have moderate appetite, then one biriyani is meant for two people if you order any starter. It was so spicy. <br/><br/>So, please try this once if you want to have good biriyani in Bangalore. It has other outlets also. But didn’t visit those places. <br/>",4.0
Nitin Khot,https://www.zoma.to/LqBxqN,My friends suggest me this place.....finally we went there.....we had a lunch over there ....but they need to be more improve the food.....service was good......,3.0
Gautam Mohan,https://www.zoma.to/Nzyewl,"Heard this place through friends. And they say briyani is good. So I decided to try.<br/><br/>Mutton Briyani is the epitome of Briyani to me. I visited this place with a friend and we tried.<br/><br/>Quantity was good but the taste was not upto the mark. It was spicy and had lot of pieces of mutton which were not soft. Moreover the briyani was pricey. <br/><br/>I would not recommend this place for Briyani, not sure about other items.",3.0
Santosh K,https://www.zoma.to/Deydyq,Been there with the friends .....for the lunch......we had some starters and the veg .non veg biryani.....the starter was good but the chicken biryani was not good chicken was bit hard .....remain all was good... ,3.0
Ananda Reddy C,https://www.zoma.to/Deyxly,Food was not good not sure y zomoto has given 3.8. 600 rs 💰 got wasted :(. Food was not good not sure y zomoto has given 3.8. 600 rs 💰 got wasted :(.,1.0
Murali Krishna Balla,https://www.zoma.to/eBQgdq,"Ordered here many times but this time surprisinly got biryani packet without chicken. Very disappointed this time... Raised complaint against restaurant, will see they refund money or not. ",1.0
Avanti Singh,https://www.zoma.to/LqYXKv,"I've been to the other outlets of Meghna and have quite liked it overall, food service and stuff. Not sure about this specific outlet at Marathahalli. We reached here for late dinner couple of days back. The place was as usual pretty occupied and hustling with people. We sat, and kept waiting for someone to attend us. Had to call for someone to take our order several times. After 3-4 followups a guy came and took the order. The food was served in 5 mins. The biryani was fine and the taste like all other outlets. It was spicy.<br/>The staff had some confusion about the fan.. some wanted it on, some wanted it off and the switch was beside my table. And the entire staff was just hovering around our table, which was really irritating.<br/>Food wise the place is fine but the service can definitely be better and staff needs to be more polished and mannered.",3.0
Sowmya,https://www.zoma.to/kdQOox,"One of the best biryani places in town, even though the place is crowded all the time they serve you food real quick. Authentic flavor. It's a must try for all the biryani lovers out there ",4.0
Urbill,https://www.zoma.to/yGBaaB,Wow seafood test is better then other restaurant.well decoration. beautiful place .be polite and friendly...next time we will be came again.....👍👍👍👍👍,5.0
Raghava Kumar,https://www.zoma.to/KkrLRq,Went for lunch and had thali and asked the waiter to suggest something which goes well with rice and he told chilly chicken in Andhra style will be good . None of the items given in thali were good. Chicken was horrible and we couldn't eat one piece. It was just boiled chicken without any spices and was pathetic. Told the staff about it and he politely told we will make a note and forward your feedback. Sad to see such popular brands known for quality and taste deteriorating. Don't recommend anyone to have thali at least in marathalli branch. Don't think I am ever going to go back to this joint. ,1.0
Vishwanath Menon,https://www.zoma.to/yGNAPY,Meghanas biriyani food chain has always been one  of my favourites. They serve some really good biriyani. The restaurant is always crowded with lots of customers. The service is very good and the staff are courteous. I would surely recommend this restaurant to everyone. ,4.0
Munnangi Ram Reddy,https://www.zoma.to/gkRdXb,Chilly chicken biryani is very special here and nati biryani is awesome too had a good food #biryani #chicken #so soft Loved food #quality 🤗😍✌🏻,5.0
Poushali Mukherjee,https://www.zoma.to/pDMqqY,"Meghana food is famous for its biriyani. Today we have visited the Marathahalli outlet of theirs. We have order 5 different kind of biriyani: prawn biriyani, Keema biriyani, boneless chicken biriyani, meghana special biriyani and paneer biriyani. Rice for all of taste same only they have changes main ingredients(chicken and prawn, paneer). I feel they have down graded their taste a little bit. Prawn and boneless chicken biriyani at Marathahalli outlet is good.",3.0
Vedant Modi,https://www.zoma.to/lAGvMy,I wud rate it to be the best Biryani in town.<br/><br/>Its flavour is Authentic & love the use of spices.<br/><br/>Quick service & neat interiors.<br/><br/>Nothing to complain for.<br/><br/>It always maintains its quality & consistent.<br/><br/>A MUST MUST TRY !!!,4.0
Ravindar Natarajan,https://www.zoma.to/lAGapm,"I went to this Marathahalli branch with my friends. This branch is more spacious compared to Koramangala branch. Biriyani was as usual delicious, also ordered chicken fry. Both were good. Had a good time with friends here.",4.0
Prajwal,https://www.zoma.to/oLzpbZ,My favourite place in Bangalore...<br/>They serve the world's best biryanis.<br/>The chicken 555 is a must try.<br/>This is a must visit place for all the foodies!!!!,5.0
Abhinav Bal,https://www.zoma.to/bZGaPN,"I have always loved the Biriyani served at Meghana, and this outlet is no different. The quantity is more than enough for 2, and the taste is nice and spicy - just what you would expect from a good quality Andhra style biriyani. Accompany that with a fish fry or something, and you are good to go !!",4.0
Charanpreet Singh,https://www.zoma.to/XQRqYr,"It was during my last visit to Bangalore I was craving for a nice biryani.<br/>After recommendations from my fellow Marathalli friends I decided to pay a visit to Meghana!<br/>I ordered Meghana Special Biryani and Chicken 65.<br/>Biryani I must say is very different like a chicken gravy and aroma rice cooked separately and plated together.<br/>Taste: 7.5/10<br/><br/>Chicken 65 was well Spicy! And believe me friends if a person like me who snorts garama masala says it was spicy then it was freaking spicy(I'll attach a pic for your reference, 10-12 Chili's in one plate is a freaking volcano ready to explode).<br/>The thing with spicy is that it takes all the taste away from a dish and person just thinks of getting over with it fast!<br/><br/>Nevertheless the place has a legacy and a huge fan following and I respect the foodies who like Meghana, perhaps a small disclaimer next time ;)<br/>",3.0
Pramod,https://www.zoma.to/yGOLQB,One biriyani will be sufficient for two people. Special chicken boneless biryani is awesome.  Tandoori chicken was pretty good. Service is also good.,4.0
Brahma M,https://www.zoma.to/qxOolY,"boneless chicken biryani is good and mild<br/>meghana special biryani is boneless and little spicy and good in taste<br/><br/>Problem is its not fine dine restaurant. Staff will chase you to eat food and leave early, which is little odd and uncomfortable.",3.0
Monojit Das,https://www.zoma.to/dYmXYe,"This is a bad place for people who love less spicy food.. too much spicy food here.. taste is bad. I will not recomand to any one.. we have tried biriyani, plain rice, dal fry, omlet.. dal and omlet noth are pathetic",1.0
SUMAN Rathore,https://www.zoma.to/YwLZgk,I went to day .......... my self experienced are not better today .............food quality are bad ....<br/>.......not professionally staff.............................so not good..............,5.0
Jhinga Mal,https://www.zoma.to/kdPrLO,"Visited this on a sunday afternoon. Reached around 12 so not so crowded at the time. Ordered paneer biriyani, spl veg biriyani (not in the menu), butter naan and dal fry. The rice qty definitely seemed to be lesser than what we get in home delivery. Maybe that's why the paneer biriyani had an overdose of masala that spoiled the taste. The other biriyani was better. Service was quick but we had the same experience as others with waiters continuously disturbing. While we were still in the middle of food they asked if anything else was required and when we said no, promptly gave hand wash bowls and the bill, as if they wanted us to wrap up and leave!",3.0
Shakti Ranjan Samantaray,https://www.zoma.to/zoGvMy,Just loved it. Giving 4 ratings as the price has been increased as compare to previously. but taste is awesome as usual. Both quality n quantity just awesome.,4.0
Ashnna,https://www.zoma.to/KkmKmX,One of the best places to have Biryani in Martathalli. The Meghna special biryani is awesome and has set different level of expectations. Less oily and they make it spicy according to you. Biryani lovers should visit this place once.,4.0
Farah Naaz,https://www.zoma.to/vpoaGO,"Ordered fish fry, Meghana special chicken biryani, mutton Keema biryani, egg fried rice and curd rice. Fish fry was good but only 2 pieces. Meghana special biryani is one of my all time favourite biryani in Bangalore. Although the quality and taste keeps reducing day by day, I still prefer ordering this to be on a safe side. Mutton Keema biryani was similar but the mutton Keema on top was good and too spicy to handle. Even a hardcore spice eater will struggle to gulp it down. Egg fired rice was simple n classy. Not at all spicy so good for less spice eaters. Curd rice is just amazing. I would say one of the best curd rice I have eaten in a long time. Overall it's a good restaurant to visit.",4.0
Parikshit Sagar Kesavaraju,https://www.zoma.to/OmMyRM,"Fiod is good but the service and hospitality is really bad. Few items are very expenssive and over priced. Omlet is 77/- mineral water bottle is sold at 30/- wher as it s priced at 19/- as mrp. When i questioned about it, they have shown me a pamplet which says supreme court has told them to sell at any price above mrp. ",3.0
Sriman Saswat Suvankar,https://www.zoma.to/Omxzla,One of the best places to have biriyani in Bangalore. Had been here a few times. The chicken boneless biriyani is quite awesome. They have so many guys who serve the customers and so the service is super fast.<br/>Coming to the food as I said the chicken boneless biriyani is a treat to both eyes and mouth as well. If you love to eat a bit more spicy then this biriyani is for you. If you have a desire to finish one bowl of biriyani alone like me then i want you to rethink on it as the quantity of biriyani served in one bowl is more.<br/>Price of biriyani is a bit on higher side compared to other restaurants that serve the same but the taste is so good and so the price is definitely a trade off.<br/>They have special daily starters here as well. Do try it if you want to.<br/>Do visit here if you are a lover of biriyani 😊,4.0
Ananth Soy,https://www.zoma.to/oLRLvq,"Though good the main problem is with consistency. That's the hallmark of any great restaurant and this one is not quite there yet. out of the 2 times I was there, and once when I ordered, I I had a good experience only once. The other time the biryanis were cold :(",3.0
Pranshu Kohli,https://www.zoma.to/ZpMvDY,Tried hyderabadi special biryani 6 to 7 times now and loved it every time!! Location is appropriate for 2 wheelers as one can park right in front of the restaurant.<br/>,4.0
Jayati Srivastava,https://www.zoma.to/gkeXQK,Have been a fan of meghana biryani since last few years. There are many chains across Bangalore. Visited the marathalli restraunt on weekends. This place will be mostly crowed and we have to wait for 15-20 mins on an average.<br/>Coming to the food I love the hydrabadi boneless biryani here. Very spicy and extremely mouth watering. Also had guntur chicken which was proper andhra style. <br/>Had prawns fry as well for the first time here. It was good but not at par with the other dishes served here.<br/>The biryani here is sufficient for 2 people. <br/>Must try!,4.0
Nivedita Basu Dey,https://www.zoma.to/GaAAdn,Ordered Meghna special chicken biryani. Loved the taste...the food was very spicy and hot but tasted good. Loved the chilli prawns. A big thumbs up for the portion size.,3.0
Shalini,https://www.zoma.to/oLgKGZ,I always miss the Hyderabadi biryani in Bangalore. Meghana biryan lives upto the expectations and never disappoints. Must try- chicken biryani and Meghana special biryani,4.0
Rohit Vipat,https://www.zoma.to/yAomBG,Excellent food and quick service.<br/>Taste and Spice and everything was amazing.<br/>One of the best Biryani and snacks in Bangalore.<br/>Have been looking for such place for over an year,5.0
Nair,https://www.zoma.to/PoEZYB,"The love for the Meghana special chicken Biriyani started years back when they had opened their franchise in kormangala, and the love remains same forever and ever.<br/>But sometimes they charge you incorrectly.",4.0
Shatakshi,https://www.zoma.to/YkXdKM,"I am a very frequent visitor of Meghana Foods. Biryani was something which i didn't like earlier. But last year i tried Biryani in Meghana Food and since then i have started loving Biryani 😊😊.<br/><br/>Chicken boneless Biryani is what i order, everytime i visit Meghana. After having Biryani in Meghana last year i have tried Biryani at many places but the Biryani here is the best. Apart from that whatever starter you order it will be of Andhra style.<br/><br/>The resturant is generally crowded. In weekends sometimes you need to wait for 5-10 mins before you get a seat.<br/><br/>The only problem here is related to the staff. Though they are very friendly n polite but they will come to your table after every 5 mins to ask something or just check your table. This turns out to be very disturbing and uncomfortable. Feels like someone is keeping an eye upon us.<br/><br/>Apart from this everything is perfect. Chicken boneless Biryani is a must try.<br/><br/>Attaching pics from my few visits there.",4.0
KR K,https://www.zoma.to/paXXPY,"Food was good ,biriyani average but good fast<br/>Staff also friendly enjoy the my friends<br/>Captain somu the take order my friends very enjoy<br/>Thanks you friendly staff",4.0
Hanzala Ansari,https://www.zoma.to/ZqrdKX,"They make one of the spiciest biryani in the city, their boneless chicken biryani is okay and the serving concept is brilliant with separate rice and Masala, chicken pieces , gravy and raita, serving portion is good, must try. ",3.0
Shakir,https://www.zoma.to/AzkoRA,"Very few places serve biryani this good even after midnight!<br/>They have seats that have nice view of ORR.<br/>Chicken biryani boneless is my usual order here.<br/>The biryani was spicy, hot, tasty even no matter what the time.<br/>Sit here watching the traffic in ORR and contemplate how there is some much traffic even at midnight!",5.0
Koushik,https://www.zoma.to/QgObvg,"Biryani is not tasty at all it is not fresh also I smells sticky , people order because they feel very hungry  and cannot cook that doesn’t mean u can send what ever u want and we can eat that . Totally disappointed with the quality ",2.0
Siri Poovaiah,https://www.zoma.to/paknEk,They packed the wrong order.. I ordered lollipop biryani and the restaurant gave me veg biryani with some chilli chicken. The gall on these people. ,1.0
Debasish Padhy,https://www.zoma.to/YkdgLv,"Good food @reasonable price , i have been there lot of time as it is in marathalli , So they need only some kind of cleanliness in to their restaurants.",4.0
Sanjit Das,https://www.zoma.to/aLyPep,"Ordered chicken biryani  on 29th june ,it was taste less , no spices , just like boiled colored rice and white chicken , no masala at all  . very dis-satisfied .",2.0
Ramya Ponnada,https://www.zoma.to/panQRY,"Well! Being a pakka Hyderabadi but a vegetarian, I was never a BIRYANI fan. Though I tried veg Biryani (may be pulao) at most of the highly reputed places in Hyderabad, nothing felt impressive. Been to this place with friends and had to eat veg biryani. Thankfully it wasn't disappointing at all. In fact, felt so good that I had biryani continuously for 3 days at this place. Coming to value for money, they offer good quality food at an affordable price and service is decent. Overall experience is great.",4.0
Soumya Mohapatra,https://www.zoma.to/YkxzRN,Big fan of Meghna Biriyani. Everyone has his/her own taste of palate but for me its one of the best I have had so far. <br/><br/>Must try: Meghna special biriyani ,4.0
Thasbiha Amjeth,https://www.zoma.to/gwrQgl,"I love the biriyani here especially the ‘Meghana special biriyani’ and whenever I feel like eating biriyani, without any second thought I prefer ‘Meghana Foods’. The biriyani here is spicy and delicious. The chicken served along with the biriyani is boneless, juicy, tender and soft and goes well with the biriyani. I have tried few starters and nothing had disappointed me. The ambience in Marathalli outlet is good. But the outlet in Koramangala is very small and the seating arrangement is not welcoming.",4.0
Ankush Singh,https://www.zoma.to/KQMEGX,"I ordered a Meghana Special Briyani through Zomato but veg briyani was delivered. When I tried calling the restaurant and explained them their mistake they were very "" Rude "" over the phone and hung up on me many time. The staff is very rude in responding customer queries and they do not know how the delivery process works. Customer care service from Meghana Marathahalli branch is very rude. Its okay, mistake can happen from anyone but instead of accepting they shout on customer and talk very rudely to them.",1.0
